matches_optimization/fitting,matches_dataset/provenance,matches_optimization/meta,matches_publication/updated,publication_doi,uuid,matches_evaluation/method,publication_authors,matches_optimization/regularization,matches_evaluation/availability,matches_publication/doi,matches_model/availability,shortid,matches_evaluation/confidence,publication_title,matches_optimization/features,publication_created,_id,matches_optimization/config,created,publication_journal,matches_dataset/availability,matches_model/duration,matches_optimization/parameters,matches_publication/journal,updated,publication_done,matches_publication/title,matches_model/output,matches_evaluation/comparison,matches_dataset/redundancy,matches_model/interpretability,publication_skip,matches_dataset/splits,publication_year,public,matches_evaluation/measure,matches_optimization/encoding,matches_publication/pmid,matches_publication/authors,publication_updated,matches_optimization/algorithm,matches_publication/year,publication_pmid,score
,,,01/28/2022 00:13:56,10.1186/1471-2105-7-116,66a94333-8cd1-499c-86ef-0497a4c4dabc,five-fold cross-validation,"Wang H, Zheng H, Simpson D, Azuaje F",,,,,6i0xepuivt,,Machine learning approaches to supporting the identification of photoreceptor-enriched genes based on expression data.,,,63516fedb9c880af1f305b5c,,2022-09-01T15:16:05.444Z,BMC Bioinformatics,"yes, https://www.nature.com/articles/s41467-019-12812-3#Sec24",,,BMC Bioinformatics,2022-09-01T15:16:05.444Z,0,Machine learning approaches to supporting the identification of photoreceptor-enriched genes based on expression data.,,,,Black box,0,,2006,True,,,,"Wang H, Zheng H, Simpson D, Azuaje F",01/28/2022 00:13:56,ensemble decision tree model,,16524483,0.67
Newly crystallized proteins should avoid overfitting ,,"Yes, combination of different alignments  tested on independent datasets",03/09/2022 10:14:51,10.1186/1471-2164-8-78,147ddf2b-6b53-4335-b62f-87994d284310,Independent dataset form CASP11,"Al-Shahib A, Breitling R, Gilbert DR",,,,,nlj5x3dld8,,Predicting protein function by machine learning on amino acid sequences--a critical evaluation.,672 features,,63516fedb9c880af1f305b93,,2022-09-01T15:16:05.445Z,BMC Genomics,Casp 11 website (https://predictioncenter.org/casp11/index.cgi),,,BMC Genomics,2022-09-01T15:16:05.445Z,0,Predicting protein function by machine learning on amino acid sequences--a critical evaluation.,Classification prediction of residue contact.,Performance achieved with methods based on automatic multiple sequence alignment calculation,Not assessed. In principle de novo protein structure prediction experiments should involve protein with no similarity with those in public available databases,Black box,0,,2007,True,Precision as a function of effective aligned sequences,,,"Al-Shahib A, Breitling R, Gilbert DR",03/09/2022 10:14:51,Two stage neural network approach,,17374164,0.67
p is much lower than the number of features. Unclear how potential underfitting was handled,"Data are extracted from different databases (TAIR, AtGenExpress Consortium, NASCArrays). Data are in classes. Npos and Nneg are not reported.",,,10.1186/1471-2105-8-358,600b20de-7c70-41af-ad39-33121af090ef,cross validation,"Hui Lan, Rachel Carson , Nicholas J Provart and Anthony J Bonner",Not adopted,,,,ysqyy92zyr,no confidence interval reported. No statistical significance over baselines has been computed,Combining classifiers to predict gene function in Arabidopsis thaliana using large-scale gene expression measurements,290 features. no feature selection performed.,,66030aaa1502715bfe53d65c,,2024-03-26T17:49:30.048Z,BMC Bioinformatics,,not stated,"Unclear, approximately in the range of the number of features",BMC Bioinformatics,2024-03-26T17:49:30.048Z,,Combining classifiers to predict gene function in Arabidopsis thaliana using large-scale gene expression measurements,,no comparison with other approaches perfomed,Random split has been adopted for cross-validation. No redundancy check performed.,"Model is partially interpretable, since classifier paramenters can be used to assess how gene expression data related to gene response to stress.",,"Training set: 11553 data points, No test nor validation sets have been used.  Performance is scored using cross-validation only.",2007,True,ROC curve,Gene expression data,,"Hui Lan, Rachel Carson , Nicholas J Provart and Anthony J Bonner",,"Different supervised and unsupervised learning algorithms: logistic regression, linear discriminant analysis, quadratic discriminant analysis, naive Bayes, k-nearest neighbors, PCA. No new algorithm developed.",,17888165,0.71
p is much lower than number of training points. Not clear how potential undefitting has been ruled out,"Data is extracted from the PDB. Data are in classes (alpha-helix vs other), however, it is not clear ho many alpha-helix residues (positive example) are present within the 300 proteins in the dataset. Dataset previsouly used in other studies and recognized by the community (no logner available)",,,10.1186/1471-2105-8-S5-S3,b863eb51-d9ae-4fc0-bfd4-006db90d1631,Repeated random traing/test split,"Blaise Gassend, Charles W O'Donnell, William Thies, Andrew Lee, Marten van Dijk and Srinivas Devadas",No regularization applied. Validation set not used.,Not available,,,qx3ex71jye,Not reported,Learning biophysically-motivated parameters for alpha helix prediction,f=380. No feature selection performed. ,,66041e5d1502715bfe53d70a,,2024-03-27T13:25:49.790Z,BMC Bioinformatics,,,,BMC Bioinformatics,2024-03-27T13:25:49.790Z,,Learning biophysically-motivated parameters for alpha helix prediction,binary classification,Cmparison with other approaches is missing. No baseline method is considered,All proteins in the dataset are non-homologous all-alpha proteins. Unclear how redundancy reduction is performed.,"Model is interpreatable, since paramenters learning by the SVM corresponds to interpretable paramenters of an energy function",,Traning set: 150 proteins; Testing set: 150 proteins. Distributions of data classess in training and testing not shown. No validation set adopted. ,2007,True,accuracy and segment-overlap value for alpha helix (SOVa),Residue are encoded with different propensity scale for a residues to by in alpha-helix or coil,,"Blaise Gassend, Charles W O'Donnell, William Thies, Andrew Lee, Marten van Dijk and Srinivas Devadas",,support vector machine classifyer. The algorithm is not new.,,17570862,0.76
"As far as one can tell, over-fitting could not be excluded (p >> N).  Indeed, regularization was performed.","""Data were extracted from publicly available databases: UniProt, STRING STITCH; COSMIC, NCBI,  DrugBase, DrugCentral,  FooDB, KEGG, MSigDB.   The dataset contains 2048 drugs (training dataset).   The dataset had been previously used also in https://doi.org/10.1038/s41598-019-45349-y.     The procedure in [ https://doi.org/10.1038/s41598-019-45349-y ] was used to obtain classification labels for the cancer task (positive (anti-cancer drug)/negative (non anti-cancer drug): N_pos = 209 /N_neg = 1839 drugs).   
",,03/25/2022 13:35:02,10.1186/1471-2105-9-S12-S18,28fe7de1-ac05-4cf2-bfa8-d5ddd1ba32b8,"Cross-validation. The model was also tested on an independent dataset of 7793 food molecules, for their classification as anti-cancer or not anti-cancer, available for future experimental tests. The model outputs a high anticancer likelihood for a given food molecule if said molecule acts on the interactome through similar mechanisms of action as those of FDA-approved anticancer drugs. Among the anticancer-predicted molecules, e.g. genistein and pterostilbene show the most promise as cancer preventing agents, as indicated by substantial experimental evidence, gained from the literature.","Tsai RT, Dai HJ, Huang CH, Hsu WL","Yes.   L2 regularization on weights of the neural network was performed.    Space search:  1.10^(−5), 1.10^(−4), 5.10^(−4).  ",Yes. (https://github.com/ggonzalezp/hyperfoods),,The code to reproduce the results can be downloaded from GitHub (https://github.com/ggonzalezp/hyperfoods),v536tc3b5t,"Confidence intervals and statistical significance are reported. Statistically significant higher performance measures were obtained by the used model, relative to the baseline method and to the method without network propagation used in https://doi.org/10.1038/s41598-019-45349-y.",Semi-automatic conversion of BioProp semantic annotation to PASBio annotation.,"Initial f0) = number of genes x number of drugs (15135x2048).  After the GNN step, each drug has an associated feature vector, so that the number of features is reduced to f < f(0). ",,63516fedb9c880af1f305b1c,"Yes. Hyperparameter settings for every method are reported. For neural models, hyperparameter candidates can be found in Table 1, Characteristics of the neural network models architecture can be found in text.",2022-09-01T15:16:05.443Z,BMC Bioinformatics,Yes :  data to reproduce the results can be downloaded from GitHub (https://github.com/ggonzalezp/hyperfoods).  All data were extracted from publicly available databases.,"Training time is expressed as milliseconds per sample per epoch, to facilitate the estimation of the total training time the proposed neural models would need for a different dataset.",,BMC Bioinformatics,2022-09-01T15:16:05.443Z,0,Semi-automatic conversion of BioProp semantic annotation to PASBio annotation.,"Regression is the output by neural networks, i.e. a probability distribution for anticancer/non-anticancer categories), which is taken in input by SVM for a binary classification output.","A baseline input is used, in which all drug targets are set to zero. To motivate the use of network propagation, versions of the baseline and proposed methods without network propagation were also evaluated (for comparison to the method used in https://doi.org/10.1038/s41598-019-45349-y, which did not use network propagation). F1 score and AUPR were significantly higher with the adopted models.",,"Transparent : The attribution recall score for the best performing model is computed, to assess whether the model predicts drugs as anticancer preferentially based on the feature values in cancer-related genes, and found to be very high (85%). This means that the graph neural model classifies drugs as anticancer preferentially based on the value of the input features in cancer-related genes, which adds to the biological plausibility of the model. In addition, 6 use cases were invetigated. For all 6 drugs studied, over-represented pathways successfully recovered pathways described in the literature along with cancer-related
 pathways. This means that the representations learned capture the mechanisms of action of drugs.",0,"A 5-fold cross-validation was performed to assess model performance. In each split, 20% of the data is kept as the test set; from the remaining 80%, 10% is used as a validation set to perform early stopping. All splits were generated stratifying samples with respect to labels.  To balance the positive/negative classes (only 10.2% of drugs are anticancer), the contribution of each class was re-scaled to the loss function so that it is inversely proportional to class frequencies of each class during training.  ",2008,True,"Balanced accuracy, F1 score, AUPR. The last two are used as parameters which better capture the performance of a classifier in the case of a highly-imbalanced dataset.","Initially, each drug (or food molecule) is represented by a graph G of human PPI (with 15135 nodes and 177848 edges), with one binary feature per node (1 for anti-cancer, 0 for non anti-cancer).     A vector representation of the graph G is computed using a Graph Encoder, i.e. a GNN, which learns the systemic effect of drugs (or food molecules) on the PPI network.    ",,"Tsai RT, Dai HJ, Huang CH, Hsu WL",03/25/2022 13:35:02,"A  non-linear, multi-layer convolutional Graph Neural Network (GNN) was trained to encode drug features, which were then fed to a Multi-Layer Perceptron (MLP) to output a probability distribution.  The probability distributions were passed to a SVM for the binary classification of nodes. The training was end-to-end.",,19091017,0.81
"According to the author's statement, the AUROC values of the training (0.98) and of the testing (0.99) sets were ""most likely over-fitting"" -- (AUROC of the independent validation set resulted 0.8).                                                                                ","Upon ethics approval obtained locally at Waitemata District Health Board (New Zealand), hematology raw hospital data were downloaded from the Information Process Unit (IPU) of the hospitals.  Data from 43,761 patients were collected between 1 July 2019 and 8 June 2020 from two hospital's flow cytometry analyzers.     A total of 2168 of SARS-CoV-2 PCR tests could be matched to patients with Full Blood Counts (FBC) data.   9 patients with 102 FBCs were SARS-CoV-2 positive, 2159 patients with 15,243 FBCs were SARS-CoV-2 negative.",,04/18/2022 16:37:38,10.1093/bioinformatics/btn189,56505402-9ea8-41a0-9132-ea658a7eee7f,"Validation (most likely 5-fold cross-validation, even if it not mentioned explicitly) on training set and validation on an independent set. Independent set: new data collected from 9 June 2020 to 24 August 2020 during New Zealand’s second wave.","Klammer AA, Reynolds SM, Bilmes JA, MacCoss MJ, Noble WS",Tools eventually applied to avoid overfitting are not mentioned.,"The materials, data, code and associated protocols are available to readers with application to the corresponding author and Waitemata privacy, security and governance group with a limited data sharing agreement.",,"The materials, data, code and associated protocols are available to readers with application to the corresponding author and Waitemata privacy, security and governance group with a limited data sharing agreement.",5867a1dxop,"AUROC from ML model was 0.80, from univariate predictor was 0.77, but the small difference was not statistically significant, according to 95% Confidence Intervals.",Modeling peptide fragmentation with dynamic Bayesian networks for peptide identification.,"Apparently, 20 parameters from cytofluorometry and 4 parameters from standard biochemical laboratory data were used in input.    it is not mentioned whether some of the parameters related to primary diagnoses of other diseases, or related to age, ethnicity and sex were also used.   ",,63516fedb9c880af1f305b1d,Authors state that BigML models will be shared without limitations.,2022-09-01T15:16:05.443Z,Bioinformatics,"The materials, data, code and associated protocols are available to readers with application to the corresponding author and Waitemata privacy, security and governance group with a limited data sharing agreement.     ",,"not reported. Most likely, however, the number of parameters was as in the software package by default.",,2022-09-01T15:16:05.443Z,0,Modeling peptide fragmentation with dynamic Bayesian networks for peptide identification.,Binary prediction of a positive or negative SARS-CoV-2 PCR result.,A comparison is reported between the boosted decision tree model and the highest univariate predictor for COVID-19 (highly fluorescent lymphocytes count % [HFLC%]).,"Since the 102 FBCs sample came from 9 positive patients only, independence seems doubtful. ",Black box. No information about the optimized parameters were reported.,0,"Models were trained, tested and then validated in an independent cohort. Due to the low number of COVID-19 PCR-positive cases, serial results for each positive case were used for descriptive statistics and in ML models, ""in the assumption that this would include the various stages of the disease and convalescence"".    A total of 102 (N_pos) instances (serial FBCs in 9 patients identified during New Zealand’s first lockdown) and 204 (N_pos) control FBCs in unique patients were used for model training and testing.   For independent validation:  11 FBCs from 3 patients with COVID-19 were used for validation with 6770 controls.",2008,True,AUROC (in spite of the much higher numerosity of negative versus positive samples in the datasets).,Global features.,,"Klammer AA, Reynolds SM, Bilmes JA, MacCoss MJ, Noble WS",04/18/2022 16:37:38,Boosted decision tree,,18586734,0.9
Not assessed,In silico gene expression data from DREAM Challenge 4,,03/24/2022 13:09:43,10.1186/1471-2105-9-57,9052c56d-022c-45d9-8b82-58312399f0dc,Evaluation of two datasets,"Zhao XM, Wang Y, Chen L, Aihara K",,,,"Matlab Code
 http://www.plosone.org/article/fetchSingleRepresentation.action?uri=info:doi/10.1371/journal.pone.0150611.s002",ali2ohlvnk,,Gene function prediction using labeled and unlabeled data.,Expression level of the genes under different conditions,,63516fedb9c880af1f305b94,,2022-09-01T15:16:05.445Z,BMC Bioinformatics,,,Increases with the size of the network. They scale with the number of possible edges,BMC Bioinformatics,2022-09-01T15:16:05.445Z,0,Gene function prediction using labeled and unlabeled data.,Network reconstruction,Comparison with state-of-the-art algorithms,Not assessed,,0,Networks of different sets of genes for wt and perturbed networks,2008,True,AUROC and AUPR,Global features,,"Zhao XM, Wang Y, Chen L, Aihara K",03/24/2022 13:09:43,Learning Gaussian Bayesian networks with interventions,,18221567,0.71
Cannot be determined,"Data taken from SCOP database (release 1.69). Multi-class data where each class corresponds to a SCOP superfamily. Number of superfamilies is 74 and 1458 in in Set A  and Set B, respectively.  Number of proteins is 643 and 2182 in Set A and Set B, respectively.",,,10.1186/1471-2105-9-389,804c2b2b-e663-4d3a-8042-7d2a35ad2122,cross-validation and independent test set,"Iain Melvin, Jason Weston , Christina S Leslie and William S Noble",No  ,"yes, through the author website",,"yes, thrugh the author website",vwy8sti3pw,not reported,Combining classifiers for improved classification of proteins from sequence or structure,,,66040f611502715bfe53d6e7,"yes, hardcoded into the source code",2024-03-27T12:21:53.450Z,BMC Bioinformatics,yes (URL),not reported,Not clearly declared.,BMC Bioinformatics,2024-03-27T12:21:53.450Z,,Combining classifiers for improved classification of proteins from sequence or structure,multi-class classification,"Yes, with a single external tool (AutoSCOP)","Testing set should be independent, given that split has been perfomed at the level of SCOP superfamilies",,,"Dataset A: N_train=543 (proteins), N_test=110 (proteins) ; Dataset B: N_train=1740 (proteins), N_test=442 (proteins)",2008,True,Per-class error rate,Protein primary sequence. Profile kernel is used for SVM,,"Iain Melvin, Jason Weston , Christina S Leslie and William S Noble",,Combined kNN and SVM. ,,18808707,0.81
Optimization of the number of features used by the model,Dataset:  316 sugar/sweeteners compounds of known sweetness collected by the authors from literature sources in the SweetenersDB database . Already used previously by the same authors (in a less-updated version).   ,,02/23/2022 23:30:01,10.1186/1471-2105-10-25,1fe140b6-a570-49cf-bccb-e58aa1719bec,"Cross-validation. Novel experiments: The virtual screening of a large database of natural compounds (4796) identified thousands of putative sweeteners, of which 3 were selected for in vitro functional assays of the human sweet taste receptor. Among them, arctiin, with a novel scaffold, was identified as a novel agonist of the T1R2/T1R3 sweet taste receptor.","Brown JB, Akutsu T","Yes.  To avoid any model bias due to overfitting, the number of features used by the model is a hyperparameter that has been optimized. ",,,,2d714axh0n,"Confidence intervals for coefficient of determination are shown in Fig. S2, but a statistical significance analysis among the different tested methods is not reported","Identification of novel DNA repair proteins via primary sequence, secondary structure, and homology.","""For each molecule, 635 molecular descriptors for the Dragon dataset, and 506 features for the “open-source” dataset were used in the model.   For each of these two descriptors sets, the initial number of features had been reduced by removing near-constant features (two or less unique values), features with a standard deviation below 0.001, and features with a correlation greater than 0.95.       During cross-validation, selection of descriptors was done by keeping a given percentile of the highest ranked descriptors based on their Mutual Information with the endpoint. The optimal percentile of features was tuned as a parameter of the Grid Search.   
""",,63516fedb9c880af1f305b3a,"A web server implementing the “open-source” model was developed and is freely available at http://chemosimserver.unice.fr/predisweet/. The 32 descriptors for the “Dragon” model, and 51 descriptors for the “open source” model are also reported.",2022-09-01T15:16:05.443Z,BMC Bioinformatics,Yes.  Dataset available in the SweetenersDB database http://sebfiorucci.free.fr/SweetenersDB/sweetenersDB.html  ,,Default defined in sklearn package,BMC Bioinformatics,2022-09-01T15:16:05.443Z,0,"Identification of novel DNA repair proteins via primary sequence, secondary structure, and homology.",Regression (sweetness score),"Several regression algorithms from the python package scikit-learn were evaluated: Random Forest, SVM, AdaBoost Tree, and k-Nearest Neighbors. Five-fold cross validation was performed with hyperparameter tuning using a grid search. The AdaBoost Tree model was selected as the best performing model, using 32 descriptors for the “Dragon” model, and 51 descriptors for the “open source” model.",The dataset  was split in training and validation sets using a Sphere Exclusion clustering algorithm.     The chemical space was mapped using t-SNE and PCA.,Black box,0,"64 diverse compounds (20.3%) were selected for the validation set, leaving 252 compounds in the training set.     ",2009,True,"Correlation Coefficient (R^2), cross-validated Correlation Coefficient (Q^2), coefficient of determination (|R^2-R0^2)/R^2), slope of regression line (k). The quality of each prediction is also assessed based on three metrics, namely the applicability, reliability, and decidability domains, typically used in the Quantitative Structure-Activity Relationships field.","Drugs were encoded as a set of molecular descriptors.    Molecular descriptors were computed using the Dragonpackage ('Dragon"" descriptors), or RDKit, Mordred, and ChemoPy packages (“open-source” descriptors). ",,"Brown JB, Akutsu T",02/23/2022 23:30:01,"The AdaBoost algorithm on a set of 80 Decision Trees was used, as implemented in the scikit learn package.             ",,19154573,0.86
