P is much larger than the number of training points. The authors devised a training-test split which did not overlap at the CATH homologous superfamily (H) level  to better gauge performance on folds that the network has not seen before.,"The PDB chains and domain annotations used for training were accessed from version 4.3 of the CATH database.
The final training and testing set contained 17,287 and 663 chains respectively.
To fine-tune the model, 7502 and 1195 AFDB-human models were used for the training and testing sets, respectively",It is not a meta-predictor.,,10.1038/s41467-023-43934-4,5231538c-a267-4ece-a6dd-484c57f5f1d8,"They evaluated the model on a test split which did not overlap at the CATH homologous superfamily (H) level with the training set.
No mention was made of cross-validation.","Andy M Lau, Shaun M Kandathil, David T Jones",,,,It will be incorporated into the PSIPRED workbench at http://bioinf.cs.ucl.ac.uk/psipred/,nfj5rdqggm,"Yes, confidence intervals are reported. Merizo is the most performant method on the CATH-663 set when scoring by IoU. It is followed closely by UniDoc, which has a wider distribution.",Merizo: a rapid and accurate protein domain segmentation method using invariant point attention,The model takes 3 inputs with varying feature dimensions.,,6638a35eb30933003cc215bd,The model is accessible through https://github.com/psipred/Merizo,2024-05-06T09:31:10.078Z,10.1038/s41467-023-43934-4,The code and network weights of Merizo are available at https://github.com/psipred/Merizo,Average time per target (second) on GPU: 0.112,The model is a small encoder-decoder network with approximately 37 M parameters (20.4 M in the encoder and 16.8 M in the decoder).,,2024-05-06T09:31:10.078Z,,Merizo: a rapid and accurate protein domain segmentation method using invariant point attention,The model has elements of both classification and regression tasks.,"The benchmark compares the accuracy of domain assignments by Merizo against those produced by four recently published methods including DeepDom, a CNN-based method from Eguchi et al (referred to as Eguchi-CNN), SWORD and UniDoc.
They also included four baseline measures, including scoring ECOD assignments against CATH (where ECOD assignments are treated as a prediction result), and three random assignment methods prefixed with’Random’, where the domain count is estimated according to the Domain Guess by Size method.",Further redundancy filtering with CD-HIT39 was performed to cluster targets which had a sequence identity of greater than 99%.,"The model is a deep neural network with 37 M parameters, rendering it a black box.",,The authors devised a training-test split which did not overlap at the CATH homologous superfamily (H) level  to better gauge performance on folds that the network has not seen before.,2023,True,"They scored predictions based on (1) how well the residues in a predicted domain overlap with a true domain, measured via the intersect-over-union (IoU) between residues in the predicted and
ground-truth domain, and (2) how precise the predicted domain boundaries are, when assessed using the Matthews Correlation Coefficient (MCC).","The model takes three inputs: a single representation, pairwise representation and backbone frames. The single representation is produced by one-hot encoding the primary sequence into 20 amino acid classes and then projected into 512 feature dimensions. For the pairwise representation, authors used the pairwise distance map derived from alpha carbons, directly embedded into 32 feature dimensions as continuous values using a linear layer. Finally, the Euclidean backbone frames are calculated from each residue “frame” (N-CA-C atoms) via Gram-Schmidt orthogonalization.",,"Andy M Lau, Shaun M Kandathil, David T Jones",,"The model is a deep neural network.
It is not a novel algorithm.",,38114456,0.9
,"4 different datasets were used in two different applications of the model, all of them obtained from other publications.

Application 1: scoring of docking models 
BM5 = 3,592,600 models generated from 142 dimers using HADDOCK
CAPRI = 16,666 models generated from 13 protein dimers by over 40 different research teams using a variety of software

Application 2: binary classification of biological and crystal dimers in 50/50 proportions 
MANY = 5739 dimers
DC = 161 dimers",,,10.1093/bioinformatics/btac759,2a48fdcb-6313-45be-a84a-d0c8a9843cb5,"Application 1: The model was trained with cross-validation on BM5 dataset and tested on CAPRI dataset.
Application 2: The model was trained on MANY dataset without cross-validation, and tested on DC dataset.","Manon Réau, Nicolas Renaud, Li C. Xue, Alexandre M. J. J. Bonvin ",,,,DeepRank-GNN can be installed using PyPi package manager after installation of dependencies. The source code is available on GitHub: https://github.com/DeepRank/Deeprank-GNN,u122uk9z7j,Confidence intervals are reported for AUC's.,DeepRank-GNN: a graph neural network framework to learn patterns in protein–protein interfaces,"48 features.
No mention on feature selection.",,6638a3d4b30933003cc215c5,Available on GitHub: https://github.com/DeepRank/Deeprank-GNN,2024-05-06T09:33:08.069Z,Bioinformatics,All datasets are available from the SBGrid data repository https://data.sbgrid.org/dataset/843/,"Average time of graph generation step per model (second) = 0,65
Average scoring time per model (second) = 2,8E-02 ",,,2024-05-06T09:33:08.069Z,,DeepRank-GNN: a graph neural network framework to learn patterns in protein–protein interfaces,The model can be used in both classification and regression tasks. ,"in both applications, the model was compared and benchmarked to other software, including their own previous model.","The splits have been done randomly by sklearn StratifiedKFold tool in an independent way.
No mention on redundancy reduction by pairwise identity.","Due to the complexity of data pre-processing and the model itself, it appears be a black box or hardly interpretable at least.",,"BM5 = 10% test, 90% training and evaluation in a 10-fold cross validation that each fold is splitted 80-20 for training and evaluation, respectively.
CAPRI  = completely used to benchmark the trained model on BM5 with other software
MANY = 80-20 for training and evaluation respectively
DC = completely used for test purpose from the best model trained on MANY",2023,True,"Area under the ROC Curve (AUC), MSE, R2, Accuracy, TP rate, and TN rate were reported in Application 1.
Accuracy, Specificity, Sensitivity, and Precision metrics were reported in Application 2.","The graph representation of a PPI is split into two sub-graphs, i.e. the internal graph connecting atoms from the same protein and the external graph connecting atoms from distinct proteins. The two sub-graphs are sequentially passed to two consecutive convolution/activation/pooling layers. The two final graph representations are flattened using the mean value of each feature and merged before applying two fully connected layers.",,"Manon Réau, Nicolas Renaud, Li C. Xue, Alexandre M. J. J. Bonvin ",,"The model is a Graph Neural Network.
It is not a novel model.",,36420989,0.76
"The exact number of total parameters not reported. To rule out overfitting, early stopping was used with validation set and additionally, a dropout rate of 0.3 was applied.","The dataset comprises 4229 protein sequences (DM4229), with 72 fully disordered chains from DisProt v5.0 and 4157 high-resolution X-ray crystallography structures from PDB.
Additionally, there are also four independent test datasets: SL329, DisProt228, Mobi9230, and DisProt452,","Yes, the model uses embeddings generated by unsupervised pretrained language models, namely ProtTrans (ProtT5-XL-U50) and ESM-1b.",,10.1093/bib/bbad173,74d82093-c2cb-4840-8d8a-dc23995f7c82,"Authors evaluated the model on a testing set of 1229 proteins (DM1229), in addition to four independent test datasets SL329, DisProt228,
Mobi9230 and DisProt452.","Yidong Song, Qianmu Yuan, Sheng Chen, Ken Chen, Yaoqi Zhou and Yuedong Yang"," Yes, early stopping was used with validation set. Additionally, a dropout rate of 0.3 was applied.",,,"The datasets, the source codes and the trained model are available on https://github.com/biomed-AI/LMDisorder.",nit3xkdwep,,Fast and accurate protein intrinsic disorder prediction by using a pretrained language model,"Authors extracted the hidden states from the last layer of the ProtTrans encoder as sequence features, which is an n × 1024 matrix (n is the sequence length).",,664234d0b30933003cc21777,"The datasets, the source codes and the trained model are available on https://github.com/biomed-AI/LMDisorder.",2024-05-13T15:42:08.260Z,Briefings in Bioinformatics,"The datasets, the source codes and the trained model are available on https://github.com/biomed-AI/LMDisorder.",For a protein with 500 residues it takes 1 second on an Nvidia GeForce RTX 3090 GPU.,"The number of total parameters is not explicitly stated but authors reported following parameters:
2-layer transformer network
128 hidden units
Hyperparameters: h = 4, ε = 0.05
Batch size: 12
Dropout rate: 0.3
Adam optimizer with learning rate of 3 × 10^(-4)
Binary cross-entropy loss function
Implemented with PyTorch 1.7.1

p was selected through searching all hyperparameters through a grid search.",Briefings in Bioinformatics,2024-05-13T15:42:08.260Z,,Fast and accurate protein intrinsic disorder prediction by using a pretrained language model,It is a binary classifier model.,"The model was compared with seven single-sequence-based methods (ESpritz-N, ESpritz-D, ESpritz-X, IUPred2A-short, IUPred2A-long and Spot-Disorder-Single) on DM1229 and SL329. 
In addition, it was compared to NetSurfP-3.0, which is based on ESM-1b language model. ","The datasets were split into training, validation, and testing sets randomly.
To ensure independence between training and test sets, redundancy reduction was enforced by using a sequence similarity cutoff of <25%, as determined by BLASTClust.",No mention was made on interpretability. The model appears to be a black box due to its complexity.,,"The training set consists of 2700 proteins, the validation set 300 proteins, and the testing set 1229 proteins (DM1229).
There are also four independent test datasets: SL329, DisProt228, Mobi9230, and DisProt452.",2023,True,"Authors employed the area under the receiver operating characteristic curve (AUCROC), precision (Pr), sensitivity (Se), specificity (Sp), the area under the precision-recall curve (AUCPR), Matthews correlation coefficient (MCC), and the weighted score Sw (Sw = sensitivity + specificity – 1) to evaluate the performance of the model.","First, the protein sequence is inputted into the pretrained language model ProtTrans to yield the sequence embedding, which is augmented by Gaussian noise to avoid overfitting.",,"Yidong Song, Qianmu Yuan, Sheng Chen, Ken Chen, Yaoqi Zhou and Yuedong Yang",,"The model is comprised of transformer networks and a fully connected layer (ANN).
It is not a novel algorithm.",,37204193,0.9
"Exact p and f unkown and not detailed in text due to pre-trained BERT models in used. However, the authors used early stopping, a validation set, pre-trained BERT models with cross-comparison across 15 of these, and reported good performance on unseen test data. This in total contributes to a strong likelihood that the authors effectively addressed both overfitting and underfitting concerns. ","Data source: Europe PMC - a database for depositing life science literature was the primary data source for the study.  

The life science literature used was: titles and correpsonding abstracts.

Dataset community recognition: this was not an established dataset but created for the purpose of this study using a subset of literature data available in Europe PMC.

Npos/Nneg info: the study kept the entries where two curators agreed on the article classification label 
-Total positive or negative, n = 1,587
-Total positive: 478
-Total negative: 1,109","No - data is sourced from direct Europe PMC API query of data as detailed in text, and is not inputting meta-predictions to the models.",,10.1371/journal.pone.0294812,5f5a87ee-e6b1-441d-a425-0abbc75bb322,Independent dataset used for validation. 15% of whole dataset held out to validate the model performance.,"Heidi J. Imker, Kenneth E. Schackart III, Ana-Maria Istrate & Charles E. Cook",Yes - overfitting prevention techniques were employed.  Early stopping was undertaken using a validation set. Max of 10 epochs but early stopping and use of highest precision.,Yes - several supplmentary files well detail the evaluation. Code: https://zenodo.org/records/10105162 / ,,Source code available: Yes - https://zenodo.org/records/10105162. Algorithms and models can be run using the 2x Snakemake reusable pipelines and also an iPython notebook (ipynb) file is available for use Google Colab/other notebook deployment platforms. ,31tebn1dq4,"Confidence scores used but not confidence interval ranges. The use of the models was novel and no comparable  method was deployed in the past to draw direct comparison to these ML methods. However, manual curator validation was used as a baseline as described in text: to determine a threshold probability of < 0.978 as “low-scoring,” where 0.978 was the average probability for names determined by a curator to have been correctly predicted in the 10% random sample of the 468 articles that were manually reviewed.",A machine learning-enabled open biodata resource inventory from the scientific literature,"Not applicable as pre-trained BERT models were used. These do not use a single set of features that you directly extract and feed into the model like traditional machine learning methods. BERT learns features based on the pre-training it was subject to. 

Related info on tokenization described above with regards to BERT model input features during the model fine tuning and training for its two tasks NER and classification.",,666ca94f37ea6fa797a6c1f9,Hyperparameters detailed in 'S4 Table. Hyperparameters used for model fine-tuning for article classification and NER tasks.' - Zenodo PDF: https://doi.org/10.1371/journal.pone.0294812.s008,2024-06-14T20:34:23.344Z,PLOS ONE,"Yes, all the data in the dataset that was used has been documented in the Zenodo repository. The original source literature dataset remains available in the Europe PMC database. Biodata Resource Inventory Code Release: https://zenodo.org/records/10105162

EPMC database: https://europepmc.org/

EPMC licensing policy: https://plus.europepmc.org/user-guide#Licensing_policies","The text directly references computational need for a GPU to re-run the model training. They do not make exact/estimate statements referring to execution times but explictly state a Google Colab instance with a GPU utlising their iPython notebooks (ipynb) provided would be sufficient. This would indicate a desktop equipped with a GPU would suffice rather than there being a requirement for access to HPC resources and several GPUs. To run  

Potentially this information is more explicitly noted in the well documented supplementary materials code release: https://zenodo.org/records/10105162.","Number of parameters (p) are used in the model?: 
-Not directly mentioned but findable based on the BERT model types being well detailed. 
-Pre-trained BERT models were used, so model parameters not directly detailed in text as a result but can be found from: Hugging Face Library (https://huggingface.co/docs/transformers/en/index) where you can find the number of parameters for a pre-trained model by using the model.config.num_parameters() function.

Hyperparameters detailed in 'S4 Table. Hyperparameters used for model fine-tuning for article classification and NER tasks.'",PLOS ONE,2024-06-14T20:34:23.344Z,,A machine learning-enabled open biodata resource inventory from the scientific literature,Classification model ,"Yes, a camparison to manually curated database regisrties was undertaken as deatailed in section 2.9.2 'Comparison with existing registries.' This utilised data from re3data.org and FAIRsharing regsitries using their APIs. Limitations of the benchmark datasets noted in the text.

This was not a simpler ML model baseline as this work was novel, but instead against manually curated datasets containing the same fields the model was extracting with NER.

The authors initially expected greater overlap with re3data.org and FAIRSharing, but only 536/3112 (17.2%) inventory resources were identified in these two registries; similarly, the majority of life science resources within both re3data (975/1189, 80.5%) and FAIRsharing (1161/1640, 70.8%) are not found in their inventory.","Test and training sets were independent.

Distribution of whole data set: 70% training, 15% validation, 15% test. This aligns to general reccomended redundancy splits for ML model training, fine tuning and evaluation uses.
","Highly interpretable - the authors made expert efforts to avoid having a black box model publication. For example all code and data & configs, etc are all available on Zenodo repository and expertly documented for ease of interpretability: https://zenodo.org/records/10105162. All test and training data available and clear, linked from text to relevant repositories. Explicit study design noted in text to have been created with open science and reproducibility in mind.",,"Whole data set:
1634 literature records total. This was reduced to 1,587 (data points were kept from origianl 1,634 where 2x curators agreed on classification of pos/neg)
These were dsitributed into: 70% training, 15% validation, 15% test (hold-out).

Data points - breakdown of the initial 1,587 items of literature data collected:
-Training set: 1,110 data points
-Test set: 239 data points (+ 238 validation data points)

Was a separate validation set used, and if yes, how large was it?: yes, validation set used = 238 data points

Are the distributions of data types in both training and test sets plotted?: no - but data cleaning done through curator validation on all npos/nneg idenitfied.

The above information on the data splits can be viewed in an overview table in the paper: Table 1. Training dataset splits for the article classification task - https://doi.org/10.1371/journal.pone.0294812.t001",2023,True,"Both the perfomance of the article classification task and that of the NER task were measured to ensure best model performance.

Pre-trained BERT model selection for article classification: 
-Performance measured to selected best BERT model for the NLP tasks. 
-15 total evaluated and noted in table 3 (and cited)
-'S(upplementary)5 Table. Article classification' measures BERT model performance and documents this in relation to F1-score, Precision & Recall. 

Pre-trained BERT model selection for NER model performance:
-Performance measured to selected best BERT model for the NER tasks.
-15 total evaluated and noted in table 3 (and cited)
-'S(upplementary)6 Table. NER model performance.' measure BERT model performance and documents this in relation to F1-score, Precision & Recall. 

Mid way evaluation undertaken also to manually assess precision on a 10% random sample (n = 468) of the NER tasks. ",Data was preprocessed for use by the pre-trained BERT models independently by two curators. Article titles and abstracts were reviewed to classify them as either describing a biodata resource (pos) or not describing a biodata resource(neg). Text strings were tokenized for BERT models using specific BERT tokenizers described in text.,,"Heidi J. Imker, Kenneth E. Schackart III, Ana-Maria Istrate & Charles E. Cook",,"Two machine learning models described in the text were fine-tuned to automate the process of: 
-1: classifying research articles 
-2: extracting mentions of biodata resources from those predicted to describe a biodata resource

These were based on pre-trained BERT (Bidirectional Encoder Representations from Transformers) models.

Pre-trained BERT models leverage deep learning transformer architectures - neural networks utilised for NLP tasks. Not novel algorithm.",,38015968,1
