,"20 Alzheimer's Disease patients (AD), 10 Mild cognitive impairment (MCI) and 29 control patients. Metabolomics samples measured with HNMR and DI LC-MS/MS, identification of 142 metabolites with HNMR and 51 with DI LC-MS/MS, demographic information (age and gender)",,02/08/2022 16:25:04,10.1093/nar/gky889,805d6ac8-7e63-41b2-a36b-427fbcf4b64c,10-fold Cross-validation,"Rappoport N, Shamir R",,"Supporting information, potentially in MetaboLights repository under private accession MTBLS1695",,NA (MetaboLights accession is private),q3f9qsuitm,"p-values, CI (95%) for AUCs",Multi-omic and multi-view clustering algorithms: review and cancer benchmark.,"Correlation-based feature selection, LASSO, step-wise variable selection",,63516fedb9c880af1f305b41,,2022-09-01T15:16:05.443Z,Nucleic Acids Res,"MTBLS1695, study still private",,,Nucleic Acids Res,2022-09-01T15:16:05.443Z,0,Multi-omic and multi-view clustering algorithms: review and cancer benchmark.,,"SVM, logistic regression","Average of concentrations of overlapping metabolites between HNMR and DI LC-MS/MS. PCA to screen for and remove subjects outside of 95% percentile. Student’s t-test was performed to determine if there were any significantly different metabolites between AD, MCI, and age-matched controls (p < 0.05) when compared pairwise. Non-normally distributed data were analyzed using a Mann−Whitney U test and a Bonferroni correction was applied to account for multiple comparisons. To determine if sample demographics were statistically significantly different, a one-way analysis of variance analysis (ANOVA) was conducted using the IBM SPSS Statistics toolbox (v. 24.0).",NA (missing or inaccessible model data and source code),0,"20, 10, 29 (see provenance) * 142 metabolites, ",2018,True,"AUC, sensitivity, specificity","Log-transform, auto-scaling",,"Rappoport N, Shamir R",02/08/2022 16:25:04,"SVM (RBF kernel), Logistic regression",,30295871,0.71
See Features,The quantitative image features extracted from H&E stained whole-slide images are available from GitHub. No access to raw data provided,,03/01/2022 19:41:49,10.1186/s12864-018-4665-2,051b93a6-4e37-4b9c-8cc9-05f531317aea,"In dataset 1, five-fold cross-validation was used. To further validate our method using an external validation set, classification models were trained using dataset 1 and evaluated using dataset 2","Simopoulos CMA, Weretilnyk EA, Golding GB","Yes, see Features",,,,ixx5zlqxpf,,Prediction of plant lncRNA by ensemble machine learning classifiers.,"Due to the high dimensionality of the image features and relatively small sample size, overfitting of the data is likely; therefore, before building classification models, we performed feature selection to avoid the overfitting problem. Feature dimensionality was reduced by the mRMR algorithm42 using R package mRMRe. mRMR has been shown to be a robust feature selection algorithm in various tasks43,44,45. The mRMR algorithm was applied to all image features with regard to the class label of sample (i.e., TFE3-RCC or ccRCC) to select an informative and non-redundant set of features.",,63516fedb9c880af1f305b42,,2022-09-01T15:16:05.443Z,BMC Genomics,"yes, processed, not raw",,,BMC Genomics,2022-09-01T15:16:05.443Z,0,Prediction of plant lncRNA by ensemble machine learning classifiers.,,,,,0,,2018,True,AUC and confidence intervals were computed with the R package pROC.,,,"Simopoulos CMA, Weretilnyk EA, Golding GB",03/01/2022 19:41:49,"Logistic regression, SVM with linear or Gaussian kernels, and random forest were used to conduct supervised machine learning",,29720103,0.57
,"two public COVID-19 CT datasets: 
 -   https://www.medrxiv.org/content/10.1101/2020.04.24.20078584v3
2482 CT images from 120 patients,  N_pos 1252, N_neg 1230

 -   http://arxiv.org/abs/2003.13865
N_pos 349 CT images from 216 patients, 
N_neg 397 CT images from 171 patients",,03/04/2022 12:54:32,10.1038/s41467-018-04552-7,c61651cd-193f-4b5e-aa19-77eed7eb2649,four-fold cross-validation,"Han X, Chen S, Flynn E, Wu S, Wintner D, Shen Y",,,,,217brrych3,"outperforming the original
 COVID-Net trained on each dataset by 12.16% and 14.23%
 in AUC respectively,",Distinct epigenomic patterns are associated with haploinsufficiency and predict risk genes of developmental disorders.,,,63516fedb9c880af1f305b43,implemented with PyTorch [38] using an Nvidia TITAN Xp GPU.,2022-09-01T15:16:05.443Z,Nat Commun,"preprocessed data: https://drive.google.com/file/d/1JBp9RH9-yBEdtkNYDi6wWL79o62JD5Td/view   

",,"Batch Normalization


",Nat Commun,2022-09-01T15:16:05.443Z,0,Distinct epigenomic patterns are associated with haploinsufficiency and predict risk genes of developmental disorders.,,"firstly comparision to COVID-Net method https://doi.org/10.1038/s41598-020-76550-z (Scientific Reports) by ROC AUC
 further comparisions by p-value:
  - Series-Adapter https://scholar.google.com/scholar?as_q=Learning+multiple+visual+domains+with+residual+adapters&as_occt=title&hl=en&as_sdt=0%2C31 
  - Parallel-Adapter https://ieeexplore.ieee.org/document/8578945
  - MS-Net https://doi.org/10.1038/s41598-020-76550-z",,color maps using Grad-CAM,0,,2018,True,"Accuracy, F1 score, Sensitivity, Precision, AUC","datasets, all images are first resized to 224 × 224 in axial plane,",,"Han X, Chen S, Flynn E, Wu S, Wintner D, Shen Y",03/04/2022 12:54:32,"deep learning, novel approach",,29849042,0.86
,"Breast magnetic resonance imaging (MRI) and clinical data from 311 HER2 overexpressing breast cancer patients. 
1)        Patients were classified into two groups based on HER2 expression level. Npos=279 patients with tumours that showed HER2 protein overexpression on immunohistochemistry (IHC 3+; IHC group). Nneg=32 patients with tumours that showed HER2 gene amplification detected by FISH in the absence of protein overexpression on IHC (IHC 2+ or 1+ to 2+; FISH group).
2)        Npos=188 patients with pathologic complete response (pCR), which was defined as no residual invasive carcinoma in the breast or axillary lymph nodes (ypT0/isN0) at surgical resection. Nneg=123 patients that are non-pCR.
",,03/06/2022 19:15:35,10.1371/journal.pone.0206634,706c0f3d-b856-473d-9864-c48e3733bceb,5-fold cross validation,"Caglar MU, Hockenberry AJ, Wilke CO",,,,,vecnt31t10,,Predicting bacterial growth conditions from mRNA and protein abundances.,"1)	The final model to predict HER2 intratumour expression levels (IHC vs. FISH) utilized three MRI features. Lesion type and multifocality (clinical features) and large zone emphasis (radiomic feature).
2)	The model to predict pCR status included six MRI parameters. Lesion type and size (clinical parameters) and variance, first order entropy, 90th percentile and zone length variance (radiomic parameters).
",,63516fedb9c880af1f305b44,,2022-09-01T15:16:05.443Z,PLoS One,,,"Coarse decision tree modelling was implemented in MATLAB, with the maximum number of splits set at four and utilizing Gini’s diversity index as the splitting criterion.",PLoS One,2022-09-01T15:16:05.443Z,0,Predicting bacterial growth conditions from mRNA and protein abundances.,"1) Binary predictions of IHC (positive) or FISH (negative) samples.
 2) Binary predictions of pCR (positive) or non-pCR (negative) samples.",,Inclusion criteria for this study were HER2 overexpressing breast cancer patients who underwent not reportedC and pretreatment state-of-the-art contrast-enhanced breast MRI. 70 were excluded because they did not have pretreatment breast MRI and 64 patients with outside images were excluded because of poor image quality.,"Transparent. Assessing the presence of statistically significant differences, using Mann-Whitney U-test and Chi-squared test, across clinical and MRI features of 1) IHC vs FISH and 2) pCR vs non-pCR groups, before including them to the final model.",0,"For the prediction of pathological complete response, the data was split into training and test sets at a ratio of 4:1 (80% training and 20% test), with feature selection performed purely on the training set. Npos,train=150 patients with pCR. Npos,test=38 patients with pCR. Nneg,train=99 patients with non-pCR. Nneg,test=24 patients with non-pCR. 
Due to the low number of cases in the minority class, this was not feasible for the comparison between the IHC and FISH groups.",2018,True,"Sensitivity, specificity, diagnostic accuracy","Following ROC and correlation analysis, Breast MRIs were assessed according to the American College of Radiology (ACR) Breast Imaging Reporting and Data System (BI-RADS) lexicon.

Manual, expert review on the MRI exams and performed 3D segmentations of the whole tumour in the first post-contrast non-subtracted sequence using ITK-Snot reportedP software.

Susceptibility artefacts related to post-biopsy changes, when
present, were excluded from segmentation and only the largest
lesion was segmented in multifocal tumours. 

Enhancement maps were calculated as the percentage increase in signal from the pre-contrast image to the first post-contrast image. Radiomics and statistical analysis were performed using MATLAB and publicly available CERR (Computational Environment for Radiological Research) software.

Furthermore, data was reduced to a fixed bin number of 16 grey levels and only an interpixel distance of one was considered. CERR analysis resulted in 102 texture parameters sub-divided into six categories - 22 first order statistics, 26 statistics based on grey level cooccurrence matrices, 16 statistics based on run length matrices, 16 statistics based on size zone matrices, 17 statistics based on neighborhood grey level dependence matrices, and finally five statistics based on neighborhood grey tone difference matrices.

Features were computed for each 2D directional matrix and averaged over 2D directions and slices, since data was not isotropic. As patients were scanned at different sites, Combat harmonisation was performed to remove the centre effect (local vs. foreign scans) while retaining the pathophysiologic information (either HER2 expression or pathologic response). The harmonisation employed Bayes estimates to account for both additive and multiplicative scanner effects.

Univariate analysis was performed to identify significant parameters. Continuous variables were described as mean, standard deviation (SD), and range. The two-tailed Mann-Whitney U test for two independent samples was used to determine significant differences between groups. Correlation analysis was then employed to remove redundant parameters from advancement to model development. If a highly positive (> 0.9) or highly negative (< -0.9) correlation was noted, the parameter with the lowest area under the receiver operating curve (AUROC) was removed.
",,"Caglar MU, Hockenberry AJ, Wilke CO",03/06/2022 19:15:35,Coarse decision trees,,30388153,0.52
,made their own dataset,,03/08/2022 14:37:33,10.1371/journal.pone.0204371,f792fa0e-c332-4321-9ab0-a504c495e7c3,,"Babalyan K, Sultanov R, Generozov E, Sharova E, Kostryukova E, Larin A, Kanygina A, Govorun V, Arapidi G",,,,,qxfdrs4tuj,ML algorithms metrics,LogLoss-BERAF: An ensemble-based machine learning model for constructing highly accurate diagnostic sets of methylation sites accounting for heterogeneity in prostate cancer.,"performed feature selection using the caret R package. from 89 initial features, redundant features were removed, attributes with an absolute correlation coefficient of 0.5 or greater were also removed. Last, specific features were selected using the recursive feature elimination (RFE) method. 20 features were finally selected. ",,63516fedb9c880af1f305b45,,2022-09-01T15:16:05.443Z,PLoS One,yes in Supporting information section,,,PLoS One,2022-09-01T15:16:05.443Z,0,LogLoss-BERAF: An ensemble-based machine learning model for constructing highly accurate diagnostic sets of methylation sites accounting for heterogeneity in prostate cancer.,,,,Black box,0,"Among 222 patients, 126 developed postinduction hypotension",2018,True,"precision, recall, accuracy",,,"Babalyan K, Sultanov R, Generozov E, Sharova E, Kostryukova E, Larin A, Kanygina A, Govorun V, Arapidi G",03/08/2022 14:37:33,"Naïve Bayes, logistic regression, random forest, and artificial neural network models",,30388122,0.57
"To avoid any model bias due to overfitting, the number of features used by the model is a hyperparameter that has been optimized.","316 sweet compounds from SweetenersDB dataset.
https://doi.org/10.1016/j.foodchem.2016.10.145",,03/22/2022 13:13:16,10.1186/s12864-018-4665-2,2ab96eb2-c809-4f94-9729-9573ca70ad20,independent dataset,"Simopoulos CMA, Weretilnyk EA, Golding GB",Structures were standardized using the “standardizer” from Python.,,,,od7rdaz7w7,statistical metrics,Prediction of plant lncRNA by ensemble machine learning classifiers.,"Five-fold cross validation was performed with hyperparameter tuning using a grid search.  The optimal percentile of features was tuned as a parameter of the Grid Search.
32 descriptors for the “Dragon” model, and 51descriptors for the “open source” model",,63516fedb9c880af1f305b46,,2022-09-01T15:16:05.443Z,BMC Genomics,,,,BMC Genomics,2022-09-01T15:16:05.443Z,0,Prediction of plant lncRNA by ensemble machine learning classifiers.,regression to predict the logSw (relative sweetness),"e-Sweet platform (Zheng et al., 2019) is based on a consensus model of various
 machine learning protocols. The performance of BitterSweet is comparable to
 e-Sweet and Predisweet (R2 of 0.72 on our test set) but the protocol is still unpublished, and seven molecules of the test set has not been
 considered as sweet.",The updated SweetenersDB was split in training and test sets using a Sphere Exclusion clustering algorithm. ,direct correlation between compound and sweetness,0,"64 diverse compounds (20.3%) were selected for the test set, leaving 252 compounds in the training set",2018,True,"predictive performance was evaluated based on criteria previously defined by: https://doi.org/10.1016/S1093-3263(01)00123-1.
 correlation coefficient, coefficient of determination, slopes of the regression lines through the origin for the observed vs. predicted and predicted vs. observed values respectively, corresponding coefficients of determination, root mean squared error, mean absolute error","Every compound in the datasets were collected as SMILES strings and sanitized with RDKit. The resulting datasets consisted of 635 descriptors for the Dragon dataset, and 506 features for the “open-source” dataset. ",,"Simopoulos CMA, Weretilnyk EA, Golding GB",03/22/2022 13:13:16,"Random Forest, Support Vector Machine (SVM), Adaptative Boosting with a Decision Tree base estimator (AdaBoost Tree), and k-Nearest Neighbors. AdaBoost Tree was selected",,29720103,0.86
"many more features, if one considers that every RGB value as a feature.  ","Comes from two of other publications [13] and [8]. Note that the purpose of this article is to show a new data representation for classification. First data set consist of 365 NGS samples, 108 are recently infected hosts and 257 are chronically infected hosts. The second set consists of 335 infected persons, 142 correspond to outbreaks with more than one person and 193 are isolated cases. the latter is used for clustering, so not further considered here","not features coming from other predictors, all raw data ",03/28/2022 23:21:09,10.3892/ol.2018.8860,39fb8263-4ce3-4283-87ed-5ceba5717b62,,"Zhang TM, Huang T, Wang RF",Cross-validation approaches,might be part of the githuv rep,,yes via GitHub,9m31lscgpm,,"Cross talk of chromosome instability, CpG island methylator phenotype and mismatch repair in colorectal cancer.","RGB matrices encoding sequences, yet unclear how this works exactly.",,63516fedb9c880af1f305b47,,2022-09-01T15:16:05.443Z,Oncol Lett,"from other papers, and requests can be made to the senior author. Data also available via GitHub link",,"ML parameters are optmized, e.g.  regularization parameter c for SVM and number of trees for RF.  Not all parameters are systematically mentioned ",Oncol Lett,2022-09-01T15:16:05.443Z,0,"Cross talk of chromosome instability, CpG island methylator phenotype and mismatch repair in colorectal cancer.",binary classification,"method in ref [32], which has significantly worse performance.","No stratification explicitly discussed, yet leave-one-outbreak out aims to resolve overlaps between the folds used for training and testing.",no obvious interpretation,0,"no separate validation set. Cross-validation is used, both classic 10-fold and ""leave-one-outbreak-out"", also under sampling of the larger set (chronically affected) is tested.",2018,True,"Accuracy, AUC, presicion and recall",The paper proposed sequence image normalisation for encoding.  yet very poorly explained and thus difficult to understand,,"Zhang TM, Huang T, Wang RF",03/28/2022 23:21:09,"A series of classification methods, all from scimitar learn ; including SVM (best performance), RF and NB. ",,30008861,0.86
,Yes: used by previous papers. N_pos and N_neg are given.,,03/28/2022 23:57:02,10.3389/fpls.2018.01559,81c5e03c-ebb1-44ac-b252-0b787354659d,independent datasets,"Zimmer D, Schneider K, Sommer F, Schroda M, Mühlhaus T",Yes:  box constraint parameter,,,No. Link to project (https://zhulab.ahu.edu.cn/m5CPred-SVM/) is broken,v1vwcbzzui,"No. Justification based only on evaluation values difference (acc, sn, sp, pre, mcc, f1, AUROC)",Artificial Intelligence Understands Peptide Observability and Assists With Absolute Protein Quantification.,Yes: 6 f. Wrapper method (sequence forward selection). ten-fold cross-validation on training dataset.,,63516fedb9c880af1f305b48,,2022-09-01T15:16:05.444Z,Front Plant Sci,"Yes: Supp data of referenced publication,  and GEO query",,"Yes: box constraint and kernel scale, optimised by a grid search",Front Plant Sci,2022-09-01T15:16:05.444Z,0,Artificial Intelligence Understands Peptide Observability and Assists With Absolute Protein Quantification.,,"Yes: RNAm5Cfinder, iRNA-m5C, iRNAm5C-PseDNC, RNAm5CPred, PEA-m5C",Yes: random selection with redundancy removal in pos and neg sets (>70% sequence identity CD-HIT),~Yes: Results for different feature selections,0,Yes: Size of N_pos and N_neg for training and test sets.,2018,True,"accuracy, sensitivity, specificity, precision, Matthews correlation coefficient and F1-score, AUROC","Yes: sequence features (KNF/NC, KSNPF, PSNP, KSPSDP, PseDNC, CPD)",,"Zimmer D, Schneider K, Sommer F, Schroda M, Mühlhaus T",03/28/2022 23:57:02,"Yes: SVM (compared to KNN, adaboost, random forest, decision tree, logistic regression and XGBoost)",,30483279,0.76
,"For each dataset 3 categories are considered: Smokers (S), Former Smokers (FS), and Never Smokers (NS). For each dataset N_S, N_FS, and N_NS will be used for the number of Smokers, Former Smokers, and Never Smokers respectively. For each dataset only data related to Dnot reported methilation.

Dataset 1: data from 474 individuals from the Dietary, Lifestyle and Genetic determinants of Obesity and Metabolic syndrome (DILGOM). N_S = 113, N_FS = 118, N_NS = 243. Used in other papers.

Dstaset 2: data from 408 individuals from the Finnish Twin Cohort (FTC). N_S = 67; N_FS = 141; N_NS = 200. Used in other papers.

Dataset 3: data from 687 individuals from the GSE42861 in Gene Expression Omnibus (GEO). N_S = 266; N_FS = 228; N_NS = 193. Used in other papers.

Dataset 4: data from 464 individuals from the GSE50660 in Gene Expression Omnibus (GEO). N_S = 22; N_FS = 263, N_NS = 179.",,03/28/2022 00:12:23,10.1158/1541-7786.MCR-17-0378,54b0bca4-f5c2-48bb-81d3-2aa6f88cbafc,Using independent dataset.,"Ding MQ, Chen L, Cooper GF, Young JD, Lu X","Introduction of a parameter ""lambda"" in the penalized log likelihood procedure for selecting the ""trainable"" parameter. Selection of the ""lambda"" parameter through cross-validation.",,,Code is available at: https://github.com/sailalithabollepalli/EpiSmokEr. No License provided.,c80vqcn356,,Precision Oncology beyond Targeted Therapy: Combining Omics Data with Machine Learning Matches the Majority of Cancer Cells to Effective Therapeutics.,Number of f = 122.,,63516fedb9c880af1f305b75,The code and the parameters used are available at: https://github.com/sailalithabollepalli/EpiSmokEr. No license specified.,2022-09-01T15:16:05.444Z,Mol Cancer Res,"Dataset 1: yes. Dataset ID: EGAD00001000200; URL: https://ega-archive.org/datasets/EGAD00001000200; license: stated with specific Data Use Ontology (DUO) codes: DUO:0000005, DUO:0000026, DUO:0000027, DUO:0000029, DUO:0000019, DUO:0000028.

Dataset 2: no (available upon request at: https://thl.fi/en/web/thl-biobank/for-researchers/sample-collections/twin-study)

Dataset 3: yes. Dataset id: GSE42861; URL: https://www.ncbi.nlm.nih.gov/geo/query/acc.cgi?acc=gse42861; license: not reported

Dataset 4: yes. Dataset id: GSE50660; URL: https://www.ncbi.nlm.nih.gov/geo/query/acc.cgi?acc=GSE50660; license: not reported",,"Number of p not reported, but could be inferred from the context.",Mol Cancer Res,2022-09-01T15:16:05.444Z,0,Precision Oncology beyond Targeted Therapy: Combining Omics Data with Machine Learning Matches the Majority of Cancer Cells to Effective Therapeutics.,"Regression (probability scores of being Smoker, Former Smoker or Never Smoker)",Comparison with non-ML methods provided. An extensive comparison was not performed due to differences in the methods.,"Dataset 1, 2, 3 and 4 are independent from each other.",Black box.,0,"Dataset 1: Used as training test. Used for cross-validation randomly subdividing data in 90% training and 10% test data. Distribution of S, FS, and NS after random subdivisions is not reported

Dataset 2: used as independent set to verify generalization capability of the classifier. Distribution of S, FS, and NS stated above.

Dataset 3: used as independent set to verify generalization capability of the classifier. Distribution of S, FS, and NS stated above.

Dataset 4: used as independent set to verify generalization capability of the classifier. Distribution of S, FS, and NS stated above.",2018,True,Sensitivity and Specificity,Training dataset are quantile-normalized before training.,,"Ding MQ, Chen L, Cooper GF, Young JD, Lu X",03/28/2022 00:12:23,Least absolute shrinkage and selection operator (LASSO).,,29133589,0.76
