,"Simulated and real-world experimental scRnot reported-seq datasets: the simulated sets had 100 points for each of 3, 5, 7, or 9 classes. The real-world sets were 4 from literature (1059 points with 3 classes, 367 points with 6 classes, 3005 points with 7 classes and 705 points for 10 classes). Some of the labels of all the datasets were artificially corrupted.",,03/27/2022 23:10:49,10.1016/j.ebiom.2020.103042,d6512a82-bc58-4d38-a7de-a80eecdc7a16,Training data only,"Bitencourt AGV, Gibbs P, Rossi Saccarelli C, Daimiel I, Lo Gullo R, Fox MJ, Thakur S, Pinker K, Morris EA, Morrow M, Jochelson MS",,,,https://github.com/SydneyBioX/scReClassify; https://bioconductor.org/packages/release/bioc/html/scReClassify.html; GPL-3 license,4zvfuyfezh,,MRI-based machine learning radiomics can predict HER2 expression level and pathologic response after neoadjuvant therapy in HER2 overexpressing breast cancer.,"PCA to capture at least 70%, projected to the range of 10-20 features ",,63516fedb9c880af1f305b72,Some hyperparameters are given in the text.,2022-09-01T15:16:05.444Z,EBioMedicine,"yes for real-world data: https://www.ebi.ac.uk/arrayexpress/help/GEO_data.html (ids E-MTAB-3929, GSE87795, GSE60361, GSE82187)",,Forced to be in the range of 10-20 + 4 (for SVM) by PCA to capture at least 70%,,2022-09-01T15:16:05.444Z,0,MRI-based machine learning radiomics can predict HER2 expression level and pathologic response after neoadjuvant therapy in HER2 overexpressing breast cancer.,multi-class reclassification (error correction),,,Black box,0,multiple AdaSampling (self-supervision) ,2020,True,mean classification accuracy; adjusted Rand index,Global features,,"Bitencourt AGV, Gibbs P, Rossi Saccarelli C, Daimiel I, Lo Gullo R, Fox MJ, Thakur S, Pinker K, Morris EA, Morrow M, Jochelson MS",03/27/2022 23:10:49,"SVM, random forest, ensemble learning",,33039708,0.62
,"ChIP-seq data, including uniformly processed peak calling results and peak width of promoter histone modifications from Roadmap and ENCODE projects for active (H3K4me3, H3K9ac, and H2A.Z) and repressive (H3K27me3) promoter modifications, and marks associated with enhancers (H3K4me1, H3K27ac, DNase I hypersensitivity sites). 

Curated haploinsufficient (HIS) genes, positive (Npos) training observations, were collected from haploinsufficient training genes used in previous studies and genes with haploinsufficient score of 3 in ClinGen Dosage Sensitivity Map.

Curated haplosufficient (HS) genes, negative (Nneg) training observations, included genes deleted in two or more healthy people, based on CNVs detected in 2026 normal individuals.

All data were used in previous studies.
",,02/23/2022 08:54:37,10.1186/s12920-020-00807-9,82cf0bf2-90df-48f5-9e3f-8671010c3fc3,"1) 100 randomized runs with Ntrain=90% and Ntest=10% for each run. 10-fold cross validation was applied.
 2) For the best performing model (Random Forest) all training data were used to train the final model.","Luyapan J, Ji X, Li S, Xiao X, Zhu D, Duell EJ, Christiani DC, Schabath MB, Arnold SM, Zienolddiny S, Brunnström H, Melander O, Thornquist MD, MacKenzie TA, Amos CI, Gui J",Yes. LASSO regularization was used with SVM for overfitting prevention.,Yes. Supplementary Data.,,Yes. GitHub website. https://github.com/ShenLab/episcore,58820ywq9x,Permutation testing.,A new efficient method to detect genetic interactions for lung cancer GWAS.,"The widths of called ChIP-seq peaks was used as promoter features. The counts of the interacting number of promoters and enhancers within pre-defined topologically associated domains (TADs) as enhancer features.
Specifically, the results of peak width and number of interacting enhancers were consolidated into a matrix, with each row being a gene and each column representing a combination of a tissue and a data type, e.g. “H3K4me3 peak width in fetal heart”. One combination of a tissue and a data type was referred to as one epigenomic feature. This matrix was used as input for the machine learning models.
",,63516fedb9c880af1f305b7f,Yes. GitHub website. https://github.com/ShenLab/episcore,2022-09-01T15:16:05.445Z,BMC Med Genomics,Yes. Supplementary Data.,,Alpha parameter equal to 1 for Lasso regularization. No further parameters were specified.,BMC Med Genomics,2022-09-01T15:16:05.445Z,0,A new efficient method to detect genetic interactions for lung cancer GWAS.,"Binary predictions. All training genes used to train the best performing Random Forest model, and then estimate the probabilities of being positive (HIS) for all genes. The whole process was repeated 30 times and the arithmetic mean of the 30 sets of probabilities was used as result.","Random Forest model performed better than SVM and SVM with Lasso, and it was chosen for training the final model (Episcore).
 Comparison of Episcore with pLI scores from ExAC, Shet values, and ranks of mouse heart expression level, using de novo likely-gene-disrupting (LGD) variants identified in:
 1) A previously published whole exome sequencing study DDD (Deciphering Developmental Disorders consortium) of 1365 trio families with congenital heart disease (CHD).
 2) A second CHD WES cohort of 2645 parent−offspring trios from the Pediatric Cardiac Genomics Consortium (PCGC).
 LGD variants include frameshift, nonsense and canonical splice site
 mutations. Episcore achieved better performance in prioritizing LGD de novo variants than the other methods.","Only genes with half or more of its length covered by any deletion were considered “deleted” (HS genes) in an individual.

The initial raw training may have included some false positive and false negative genes, as it contained results from automated literature mining that is known to give noisy output. To optimize the performance, the following pruning of the raw training set was performed: 

1)	Only protein-coding genes in autosomes were kept, as non-protein coding genes or genes on sex chromosomes may be under different mechanism of epigenomic regulation.
2)	From the positive training set, genes with sufficient contradictory evidence were removed (ExAC pLI ≤ 0.1 and expected loss-of-function variants >1011).
3)	From the negative training set, genes with sufficient contradictory evidence (pLI ≥ 0.2 and expected loss-of-function variants>10) were removed.
","Epigenomic features critical for the prediction were determined by calculating a Spearman correlation coefficient between each epigenomic feature and Episcore (random forest model) prediction. 
 One epigenomic feature corresponds to a data type per certain tissue/cell type. To examine which data types are more important, these Spearman correlation coefficients were plotted by data type. 
 To examine what tissue/cell types are more important, the averaged z-score for each tissue/cell type was calculated by:
 1) Converting every Spearman correlation coefficient to a Z-score using mean and standard deviation specific to each data type and
 2) Average Z-scores from various data types for each tissue/cell type.
 This analysis indicated that epigenomic features in stem cells, brain tissues, and fetal tissues contribute more to Episcore prediction than other features.",0,"Following pruning for the training set, Npos=287 curated haploinsufficient genes and Nneg=574 curated haplosufficient genes were considered for further analysis.
1)	Ntrain=90%. Ntest=10%. 10-fold cross validation for training. 100 randomized runs.
2)	Final training with all training data and estimation of probabilities.
",2020,True,"ROC curve, AUC score, sensitivity, specificity","For promoter features (H2A.Z, H3K27me3, H3K4me3, and H3K9ac), GappedPeaks were used to allow for broad domains of ChIP-seq signal. The assignment of a GapppedPeak to a gene followed these steps in order: 
1)	For each gene, only TSS of Ensembl canonical transcripts were used.
2)	A GappedPeak was assigned to a TSS if the GappedPeak overlaps with the upstream 5 kb to downstream 1 kb region around the TSS. This definition of basal cis-regulatory region around promoter was according to GREAT tool. Assigning one GappedPeak to multiple TSS was allowed.
3)	For TSS having more than 1 GappedPeak assigned, only the closest one was kept.
4)	For genes with multiple TSS and hence multiple assigned GappedPeaks, only the longest GappedPeak was kept.
After these four steps, if one gene had been associated with a GappedPeak, then the width of the peak was used as an epigenomic feature in the following machine learning models. If a gene had no associated GappedPeak, then the peak width is 0.

Coverage of H3K27ac, H3K27me3, H3K36me3, H3K4me1, H3K4me3, H3K9me3, DNase I, and Rnot reported-seq data was used as input for EpiTensor to infer interacting enhancers across distant genomic regions. This was done as balance between more input data types and more cell types included, as not every cell type has all these histone modifications characterized.
",,"Luyapan J, Ji X, Li S, Xiao X, Zhu D, Duell EJ, Christiani DC, Schabath MB, Arnold SM, Zienolddiny S, Brunnström H, Melander O, Thornquist MD, MacKenzie TA, Amos CI, Gui J",02/23/2022 08:54:37,"Random forest, Support Vector Machine (SVM), and SVM with LASSO feature selection.",,33126877,0.86
,"Positive data from lncRnot reporteddb v2, lncRnot reporteddisease. Negative data from Ensembl, Araport v11. Npos=436 lncRnot reported sequences. Nneg=? (total number of negative not known). Not previously used.",,03/12/2022 19:15:18,10.1007/s13365-020-00877-6,29042d14-1d9f-444e-b046-b5ec3e731b15,Cross-validation. No indipendent datasets,"Pulliam L, Liston M, Sun B, Narvid J",,,,Code not available,g23kv6pr5v,No confidence reported,Using neuronal extracellular vesicles and machine learning to predict cognitive deficits in HIV.,f=11. Feature selection by Recursive feature elimination,,63516fedb9c880af1f305b80,Configuration and hyper-parameter configuration available in the main text (Table 2),2022-09-01T15:16:05.445Z,J Neurovirol,"Yes, supplementary material.",,,J Neurovirol,2022-09-01T15:16:05.445Z,0,Using neuronal extracellular vesicles and machine learning to predict cognitive deficits in HIV.,,"GreeNC method (transcript filtering, no machine-learning), CPAT",,Transparent. Random forests provide feature importance,0,Ten different indipendent 10-fold cross-validation performed. N_pos and N_neg for training and testing unknown. ,2020,True,"Sensitivity, Specificity, Accuracy, ROC-AUC","Eleven features for describing complete lncRnot reported sequence: mRnot reported length, ORF length, GC%, Fickett score, hexamer score, alignment identity in SwissProt database, length of alignment in SwissProt database, proportion of alignment length and mRnot reported length (alignment length:mRnot reported length), proportion of alignment length and ORF length (alignment length:ORF), presence of transposable element, and sequence percent divergence from transposable element.",,"Pulliam L, Liston M, Sun B, Narvid J",03/12/2022 19:15:18,Stochastic gradient boosting and random forests,,32681213,0.67
,Used by previous papers,,03/03/2022 17:42:56,10.1155/2020/6248686,4f8760d4-406b-4faf-bfce-2e05bee0335c,Independent dataset,"Li J, Liu Y, Zhang Z, Liu B, Wang Y",,,,http://dlab.org.cn/PredRBR/ (not working),akj12z17yv,,PmDNE: Prediction of miRNA-Disease Association Based on Network Embedding and Network Similarity Analysis.,"63 + 63, Incremental Feature Selection",,63516fedb9c880af1f305b8c,,2022-09-01T15:16:05.445Z,Biomed Res Int,http://dlab.org.cn/PredRBR/ (not working now),,,Biomed Res Int,2022-09-01T15:16:05.445Z,0,PmDNE: Prediction of miRNA-Disease Association Based on Network Embedding and Network Similarity Analysis.,Binary predictions,"BindN, PPRint, BindN+, RNABindR2.0, RNABindRPlus, SNBRFinder", eliminating sequences more similar than 40%,Black box,0,,2020,True,"sensitivity, specificity, accuracy, precision, F-measure, MCC score",global features,,"Li J, Liu Y, Zhang Z, Liu B, Wang Y",03/03/2022 17:42:56,Gradient tree boosting,,33354569,0.57
Fitting is performed but the fitting algorithm is not explained.,The data comes from a direct experiment. They consider firing rates of ~200 ganglion cells.,,05/20/2022 15:07:04,10.3390/ijms21124236,e735e3a3-1291-4134-b91b-e7eed358f5e6,,"Ahn HS, Kim JH, Jeong H, Yu J, Yeom J, Song SH, Kim SS, Kim IJ, Kim K","yes. A ""fitting algorithm"" is mentioned but the technique is not explained.",,,,ebmz3cuuuq,Median and variance of cells across models.,Differential Urinary Proteome Analysis for Predicting Prognosis in Type 2 Diabetes Patients with and without Renal Dysfunction.,,,63516fedb9c880af1f305b8d,,2022-09-01T15:16:05.445Z,Int J Mol Sci,,,~100-150 parameters,Int J Mol Sci,2022-09-01T15:16:05.445Z,0,Differential Urinary Proteome Analysis for Predicting Prognosis in Type 2 Diabetes Patients with and without Renal Dysfunction.,The model gives as output the neuron's spike rate (time course of the firing rate).,Comparison between models used in the paper.,,Black box,0,Training set: ~80% of the data. Test set: ~20% of the data.,2020,True,,,,"Ahn HS, Kim JH, Jeong H, Yu J, Yeom J, Song SH, Kim SS, Kim IJ, Kim K",05/20/2022 15:07:04,"Single linear-nonlinear cascade models (LN), linear-nonlinear-sum-nonlinear (LNSN), linear-nonlinear-sum-nonlinear-feedback (LNSNF), linear-nonlinear-feedback-sum-
nonlinear-feedback (LNFSNF) and LNFDSNF models. (to predict firing rates of ganglion cells)",,32545899,0.57
"1) average over a wide range of K to avoid overfitting for KNN-based methods
2) Not applicable","1) We simulate random datasets by extending a casecontrol model adopted in https://doi.org/10.1186/1752-0509-2-10, for evaluation of all methods.
2)USA dataset for breast cancer metastasis","1) yes. Some in similar ways. Some other vary from unsupervised to supervised learning.
2) No",03/28/2022 00:44:11,10.3389/fgene.2020.617174,1a0158e9-2f41-4c14-9b7e-4d7369584811,"1) Not applicable
 2) 10-fold cross-validation and independent Dataset","Sun S, Fei K, Zhang G, Wang J, Yang Y, Guo W, Yang Z, Wang J, Xue Q, Gao Y, He J","1) No
2) No","1) No
 2) No",,"1)No
 2) No",3p5oxxtlts,"1)All the measurements are based on the statistics estimated from data.
 2) p-values",Construction and Comprehensive Analyses of a METTL5-Associated Prognostic Signature With Immune Implication in Lung Adenocarcinomas.,"1)50 and 200 input variables.
2) 6,168 genes as input features for network-based feature ranking method, and then top T (1,5,10...,50)",,63516fedb9c880af1f305b92,"1) No
 2) No",2022-09-01T15:16:05.445Z,Front Genet,"1) No
2) No","1) a few seconds
 2) not applicable","1) based on the complexity of each pattern
2) p=2, with complexity parameter C = 100 and RBF kernel with σ = 1",Front Genet,2022-09-01T15:16:05.445Z,0,Construction and Comprehensive Analyses of a METTL5-Associated Prognostic Signature With Immune Implication in Lung Adenocarcinomas.,"1) regression
 2) classification","1) LASSO. The performance of LASSO is worse than all the other non-linear methods when we have relatively small numbers of samples.
 2) Not applicable","1) Simulation of three different types of interaction patterns between two interacting variables xi, xj and the outcome y: “simple”, “complex”, and “very complex”. Among six pairs of interacting variables, simulation of the data by including two pairs of each pattern. Depending on the outcome then they assigned a value drawn from an equally weighted Mixture-of-Gaussian with various Gaussian components for each pattern case.
2) not applicable","1) transparent since results are based on statistics.
 2) transparent since results are based on statistics.",0,"1) Randomly assignment of outcome variable y uniformly distributed in {0, 1}. Generation of input variables: random generation of 50 input variables, randomly select six of them to simulate the individual effects and another six distinct pairs of other variables from all 1, 225 possible variable pairs to simulate significant interactive effects on disease outcome y.
Creation of 1,000 datasets for each one of the following sample sizes: 20, 40, 60, 80, 100, 120, and 140.
2) USA(train): n=286, 107 metastasis cases
Netherlands(test): n=295, 79  metastasis cases",2020,True,"1) AUC (area under ROC curve) values
 2) AUC and p-values","1) Not applicable
2) Not applicable",,"Sun S, Fei K, Zhang G, Wang J, Yang Y, Guo W, Yang Z, Wang J, Xue Q, Gao Y, He J",03/28/2022 00:44:11,"1) various methods for classification and clustering. Both supervised and unsupervised.
2) first network-based feature ranking method for selection of top genes, then SVM for classification",,33679869,1
,6 experimental datasets from the literature (803 = 171+296+46+27+35+228) and 4 classes. The raw data is not reported to evaluate the imbalances,,03/19/2022 20:19:10,10.1186/s12864-020-6661-6,4f314982-05d0-429f-aa3f-d163dc7c0834,"Cross-validation, independent dataset","Basodi S, Baykal PI, Zelikovsky A, Skums P, Pan Y",,"Only final accuracy values for training, test, and combined datasets in the supporting information.",,,l4cnu26i2o,Only standard deviations for the accuracy values are provided,Analysis of heterogeneous genomic samples using image normalization and machine learning.,"All datasets were combined and normalized using the R package limma, and batch effects were adjusted using ComBat. Then the optimal number of features (48 out of presumably 753) was selected using all datasets, potentially leading to contamination. Then subsets of 48 features were used to train models (based on dataset 1), and the best model was chosen (based on datasets 2-5 + genetic algorithm) and evaluated (based on dataset 6).",,63516fedb9c880af1f305b9a,Partially yes: in the text,2022-09-01T15:16:05.445Z,BMC Genomics,,,,BMC Genomics,2022-09-01T15:16:05.445Z,0,Analysis of heterogeneous genomic samples using image normalization and machine learning.,4-class classification,Baselines: VarSelRF and simple RFE as an alternative to their feature selection; benchmarking: ClaNC by Verhaak et al. (claimed to be the standard in the field).,Not studied,Partially transparent: the features (genes) selected in the final model were scrutinized for other associations.,0,575 data points in the training and validation sets; 228 in the test set; the raw data is not reported to evaluate the imbalances,2020,True,,global features,,"Basodi S, Baykal PI, Zelikovsky A, Skums P, Pan Y",03/19/2022 20:19:10,random forest,,33349236,0.71
,"27 electrical penetration graph (EPG) waveform recordings 
totaling 470 hours on nine different citrus varieties. Not previously used.",,03/29/2022 07:28:13,10.1038/s41467-020-15671-5,4df4e637-ba5a-4be5-83d3-aed3e3c4742c,"1) 3 repeats of 10-fold cross validation for each EPG recording.
 2) Leave-one-out cross-validation. 3 repeats of 10-fold cross validation for 5% of 26 EPG recordings (train). 1 EPG recording for testing.","Cheng J, Han Z, Mehra R, Shao W, Cheng M, Feng Q, Ni D, Huang K, Cheng L, Zhang J",,,,,du3gc2b5fz,95% confidence intervals. Confusion matrices.,Computational analysis of pathological images enables a better diagnosis of TFE3 Xp11.2 translocation renal cell carcinoma.,Main periodic components of the time series,,63516fedb9c880af1f305b9b,,2022-09-01T15:16:05.445Z,Nat Commun,,,,Nat Commun,2022-09-01T15:16:05.445Z,0,Computational analysis of pathological images enables a better diagnosis of TFE3 Xp11.2 translocation renal cell carcinoma.,"Multi-label predictions on 6 different feeding states. Binary predictions between phloem (E1 and E2) and non-phloem (C, D, NP, and G) feeding states.",,"1)	A classification model was trained and used for predictions on each EPG recording independently. 
2)	Random selection of 5% of 26 EPG recordings used as training and 1 EPG recording as testing. 27 repeats (Leave-one-out cross-validation). ",,0,"1)	Data split for each EPG recording. Ntrain = 5%. Ntest = 95%. 3 splits.
2)	Ntrain = 5% from each of 26 EPG recordings. Ntest = 100% from 1 EPG recording (27th). ",2020,True,"Average of: Accuracy, Sensitivity, Specificity, Positive Predictive value, Negative Predictive value, Prevalence, Detection Rate, Detection Prevalence, Balanced Accuracy.","EPG waveform recordings were manually classified into 6 feeding states: C, D, E1, E2, G, NP. Fast Fourier transform of EPG recordings. The 6 frequencies with the highest magnitudes, often harmonics, were extracted and used for further analysis.",,"Cheng J, Han Z, Mehra R, Shao W, Cheng M, Feng Q, Ni D, Huang K, Cheng L, Zhang J",03/29/2022 07:28:13,Random Forests Classification,,32286325,0.48
,"Training dataset of 40 pairs of Pdu protein sequences whose presence or absence of physical, protein-protein interactions (PPIs) could be experimentally validated via binding assays, complementation and expression studies or crystallographic data.

Testing dataset of protein orthologs collected from 34 bacterial genomes in the KEGG database and collapsed among 22 orthologous protein groups, which represent types of bacterial microcompartment (MCP) proteins known to be associated with the propanediol utilizing (Pdu) system.
",,03/02/2022 16:10:05,10.3389/fonc.2020.552270,961066cf-8ef7-40b4-9b4f-2659655f5c2f,10-fold cross-validation. Experimental confirmation of a predicted positive PPI from the testing dataset.,"Li J, Zhang C, Wei J, Zheng P, Zhang H, Xie Y, Bai J, Zhu Z, Zhou K, Liang X, Xie Y, Qin T",,Yes. Supporting information.,,,82s7pnn2t8,"High training accuracy for experimentally characterized PPIs, 15 of 16 correctly predicted as pos. Claiming support for the high specificity criterion.",Intratumoral and Peritumoral Radiomics of Contrast-Enhanced CT for Prediction of Disease-Free Survival and Chemotherapy Response in Stage II/III Gastric Cancer.,"For each protein pair, 7 coevolution features measuring the pairwise tree similarities have been defined. 
Of these, 4 features are based on pairwise comparison of the distance matrices, as defined in the mirrortree approach, and whose metrics correspond to the linear correlation coefficient between the two matrices in consideration. Let A and B be the two MCP ortholog groups, mA and mB their respective matrices, tA and tB their trees. The parameter mirrorAB is the correlation between mA and mB, mirrorA is between mA and ToL, and mirrorB is between mB and ToL. The fourth descriptor, mirrorAB-ToL, involves an adaptation of the mirror tree, also known as tol-mirror, which measures the correlation between mA and mB after removing the background similarity inherent to speciation events in the ToL.
The remaining 3 topological features are derived from the Icong index, defined as the probability that the Maximum Agreement Subtree (MAST) between two trees is arising by chance. Along the same idea, topological similarities were computed between tree A and ToL, tree B and ToL, and finally A and B (topA, topB, topAB).
",,63516fedb9c880af1f305ba4,,2022-09-01T15:16:05.446Z,Front Oncol,Yes. Supporting information.,,,Front Oncol,2022-09-01T15:16:05.446Z,0,Intratumoral and Peritumoral Radiomics of Contrast-Enhanced CT for Prediction of Disease-Free Survival and Chemotherapy Response in Stage II/III Gastric Cancer.,"Binary predictions of pos for an interacting protein group pair and neg for those not interacting. For prediction probability is less than 0.7 then the result is neg, and for equal or greater than 0.7 the result is pos (increased specificity).",,"Incomplete or erroneous annotations of the Pdu gene products were corrected after sequence comparison with the Pdu operon from Salmonella enterica LT2, the best-characterized strain in terms of Pdu MCP.",Not explicitly interpreted. Comparison of classification performance for fewer features and evaluation of their discriminatory power individually by ranking their accuracies in the context of an unsupervised analysis. Results support the importance of all features for optimal model performance.,0,"For the training set, Npos=16 interacting and Nneg=24 non-interacting protein pairs.
For the testing set, pairwise combinations of the 22 orthologous protein groups resulted in 231 unique protein pairs that needed to be classified.
",2020,True,"ROC curve, AUC score","For each ortholog group, its corresponding protein sequences were aligned with MUSCLE. The multiple sequence alignments were subsequently input in PhyML for the construction of phylogenetic trees using the Maximum Likelihood method. For amino acid and nucleotide-based tree construction in PhyML, the LG and HKY85 substitution matrices were used, respectively. Additionally, distance matrices were calculated for each tree, where the distance between two leaves corresponds to the sum of the branch lengths separating them. 

Comparing two trees can be subject to artefacts and lead in some cases to spurious correlations if speciation events are not taken in account. For this reason, some of the co-evolution features also involve the Tree of Life (ToL) of the 34 genomes studied, which originated from submitting sequences of their respective 16S ribosomal Rnot reported to similar treatment. Since distances in the ToL are computed from a nucleotide-based substitution matrix, the distances in the ToL matrix were rescaled for proper comparison with the protein-based distance matrices.
",,"Li J, Zhang C, Wei J, Zheng P, Zhang H, Xie Y, Bai J, Zhu Z, Zhou K, Liang X, Xie Y, Qin T",03/02/2022 16:10:05,Random Forest classifier,,33425719,0.62
